{"$id":"https://schemas.micrantha.com/dubnium/v1/example-noop-result.schema.json","$schema":"https://json-schema.org/draft/2020-12/schema","additionalProperties":false,"properties":{"capability":{"additionalProperties":false,"properties":{"name":{"maxLength":128,"pattern":"^[a-z][a-z0-9]*(?:\\.[a-z][a-z0-9-]*)+$","type":"string"},"schema_version":{"const":1}},"required":["name","schema_version"],"type":"object"},"contract_version":{"const":"1.0"},"output":{"additionalProperties":false,"properties":{"echo":{"items":{"maxLength":64,"type":"string"},"maxItems":3,"minItems":1,"type":"array"}},"required":["echo"],"type":"object"},"request_digest":{"maxLength":71,"pattern":"^sha256:[0-9a-f]{64}$","type":"string"},"request_id":{"maxLength":128,"pattern":"^[A-Za-z0-9][A-Za-z0-9._:-]{0,127}$","type":"string"},"status":{"const":"succeeded"}},"required":["contract_version","capability","request_id","request_digest","status","output"],"title":"example.noop result v1","type":"object"}
