{"$schema":"../../schemas/v1/example-noop-result.schema.json","capability":{"name":"example.noop","schema_version":1},"contract_version":"1.0","output":{"echo":["hello","hello"]},"request_digest":"sha256:d74624c1ee49c193a4077e8833d91a9aaff1575bdcfc412a116153078d01059d","request_id":"request-example-001","status":"succeeded"}
